{
    "name": "Thomas Piketty",
    "role": "Økonom & Forfatter",
    "category": "Thinker",
    "image": "/src/assets/img/influences/piketty.png",
    "quote": "Rigdommen er så koncentreret, at den nederste halvdel af befolkningen praktisk talt intet ejer.",
    "impact": "Et omfattende, datadrevet studie af rigdom og kapitalens historie. Hans arbejde udfordrer status quo ved at blotlægge dybtliggende uligheder i moderne systemer.",
    "links": []
}
