{
    "name": "John Maynard Keynes",
    "role": "Economist & Philosopher",
    "category": "Thinker",
    "image": "/src/assets/img/influences/keynes.png",
    "quote": "The long run is a misleading guide to current affairs. In the long run we are all dead.",
    "impact": "The revolutionary idea that government must manage the macroeconomy to ensure stability and full employment. His vision of a balanced society informs my views on policy.",
    "links": []
}
