{
    "name": "Thomas Piketty",
    "role": "Economist & Author",
    "category": "Thinker",
    "image": "/src/assets/img/influences/piketty.png",
    "quote": "Wealth is so concentrated that the bottom half of the population has virtually no wealth.",
    "impact": "A rigorous, data-driven look at the history of wealth and capital. His work challenges the status quo by exposing deep-seated inequalities in modern systems.",
    "links": []
}
