{
    "name": "Leo Tolstoy",
    "role": "Novelist & Thinker",
    "category": "Author",
    "quote": "Everyone thinks of changing the world, but no one thinks of changing himself.",
    "impact": "Unparalleled insight into the human condition, existential meaning, and Christian anarchism.",
    "links": []
}
