{
    "name": "Fjodor Dostojevskij",
    "role": "Romanforfatter & Filosof",
    "category": "Author",
    "quote": "Menneskets eksistensmysterium ligger ikke blot i at holde sig i live, men i at finde noget at leve for.",
    "impact": "Dyb psykologisk indsigt i den menneskelige natur, moral og kampen mellem tro og tvivl.",
    "links": []
}
