{
    "name": "C.S. Lewis",
    "role": "Forfatter & Teolog",
    "category": "Author",
    "quote": "Jeg tror på kristendommen, ligesom jeg tror på, at solen er stået op: ikke kun fordi jeg ser den, men fordi jeg ved den ser alt andet.",
    "impact": "Genial apologetik og dybe refleksioner over tro, smerte og menneskets natur.",
    "links": []
}
