{
    "name": "C.S. Lewis",
    "role": "Writer & Theologian",
    "category": "Author",
    "quote": "I believe in Christianity as I believe that the sun has risen: not only because I see it, but because by it I see everything else.",
    "impact": "Brilliant apologetics and profound reflections on faith, pain, and human nature.",
    "links": []
}
