{
    "name": "Leo Tolstoj",
    "role": "Romanforfatter & Tænker",
    "category": "Author",
    "quote": "Alle tænker på at ændre verden, men ingen tænker på at ændre sig selv.",
    "impact": "Enestående indsigt i den menneskelige tilstand, eksistentiel mening og kristen anarkisme.",
    "links": []
}
