{
    "name": "Jesus fra Nazaret",
    "role": "Etisk Revolutionær",
    "category": "Figure",
    "image": "/src/assets/img/influences/jesus.png",
    "quote": "Du skal elske din næste som dig selv.",
    "impact": "Fundamentale etiske principper og det radikale koncept om universel empati. Hans lære udgør et moralsk kompas for uselvisk tjeneste og social retfærdighed.",
    "links": []
}
