{
    "name": "John Maynard Keynes",
    "role": "Økonom & Filosof",
    "category": "Thinker",
    "image": "/src/assets/img/influences/keynes.png",
    "quote": "På lang sigt er vi alle døde.",
    "impact": "Den revolutionære idé om, at staten skal styre makroøkonomien for at sikre stabilitet og fuld beskæftigelse. Hans vision om et balanceret samfund danner rammen om mine synspunkter.",
    "links": []
}
