{
    "name": "George Orwell",
    "role": "Forfatter & Essayist",
    "category": "Author",
    "quote": "I en tid med bedrag er det at fortælle sandheden en revolutionær handling.",
    "impact": "En magtfuld kritik af totalitarisme, systematisk undertrykkelse og manipulation af sandheden.",
    "links": []
}
