{
    "name": "Fyodor Dostoevsky",
    "role": "Novelist & Philosopher",
    "category": "Author",
    "quote": "The mystery of human existence lies not in just staying alive, but in finding something to live for.",
    "impact": "Deep psychological insight into human nature, morality, and the struggle between faith and doubt.",
    "links": []
}
